{"schema":"riffdb-agent-application-alpha-run/v1","run_id":"alpha2-orders-rust-20260814-rerun-01","bundle_hash":"a58585da8dd68b77fe70554cb16c89a4da1b1ded36da6ac8945b229d9f9058f3","agent_identity":"terra-alpha2-orders-rust-20260814-rerun-01","domain":"orders","language":"rust","independent":true,"fresh_context":true,"human_interventions":0,"kernel_attempts":0,"kernel_successes":0,"handwritten_glue_lines":0,"compiler_failures":0,"runtime_failures":0,"unsupported_shapes":[],"first_write_seconds":185,"first_page_read_seconds":186,"time_to_complete_seconds":189,"source_access":{"riffdb_implementation":false,"ticketdesk":false},"boundary_passed":true,"golden_passed":true,"rating":9.3,"explanation":"The public scaffold, symbolic contract, generated Rust operations, exact-money product price, atomic reservation, and immediate fenced page read completed without source access, kernel APIs, handwritten RiffDB glue, or human intervention. The contract and query compilation path was straightforward; the authoring guide made the single routed aggregate and bounded pages clear.","transcript_sha256":"cc6fbfbbc5605c43f48751c23d6ff3b3d00b8a8309fb9f5f2c814c0e68eedab8"}
