{
  "schema": "riffdb-agent-application-alpha-run/v1",
  "run_id": "wp365-blog-rust-terra-03",
  "bundle_hash": "b72679d6d7ea66dc08e59ff547a9e5af7789f7638c862619365713618437ce11",
  "agent_identity": "terra-wp365-blog-rust-03",
  "domain": "blog",
  "language": "rust",
  "independent": true,
  "fresh_context": true,
  "human_interventions": 0,
  "kernel_attempts": 0,
  "kernel_successes": 0,
  "handwritten_glue_lines": 0,
  "compiler_failures": 4,
  "runtime_failures": 0,
  "unsupported_shapes": [],
  "first_write_seconds": 290,
  "first_page_read_seconds": 290,
  "time_to_complete_seconds": 420,
  "source_access": {
    "riffdb_implementation": false,
    "ticketdesk": false
  },
  "boundary_passed": true,
  "golden_passed": true,
  "rating": 8.8,
  "explanation": "The public contract, RiffQL, manifest, diagnostics, generated Rust client, and development workflow were sufficient to author and execute the complete bounded Blog/CMS workload. Initial diagnostics gave direct source-level corrections. Minor friction came from the scaffold lacking a Rust lockfile for an initial locked Cargo check.",
  "transcript_sha256": "d1846ab16ab08dd28a88ad00f807c4ba8c99d6c4ea97dc13760a64e7b5fc7c8a"
}
