{"schema":"riffdb-agent-application-alpha-run/v1","run_id":"orders-typescript-11","bundle_hash":"63f3e4e51c0065e6a20bf402cd7311ec3d4925aad481d18fd3c4469b7b65a5ca","agent_identity":"codex-orders-typescript-11","domain":"orders","language":"typescript","independent":true,"fresh_context":true,"human_interventions":0,"kernel_attempts":0,"kernel_successes":0,"handwritten_glue_lines":0,"compiler_failures":2,"runtime_failures":1,"unsupported_shapes":[],"first_write_seconds":522,"first_page_read_seconds":522,"time_to_complete_seconds":530,"source_access":{"riffdb_implementation":false,"ticketdesk":false},"boundary_passed":true,"golden_passed":true,"rating":9.3,"explanation":"Independent clean-room TypeScript run passed. The generated client compiled all eight symbolic commands and four named reads; a real HTTP order page completed generated product, inventory, order, line, reservation, and fulfillment commands, then performed fenced OrderDetail reads. The qualified ReserveOrder result was immediately followed by OrderDetail with the exact returned commit sequence as its read-after-commit fence. exactMoney constructed a non-null money<USD> value and the generated query returned its typed money shape. The application-boundary checker passed with zero handwritten RiffDB adaptation. Two self-corrected compiler failures (one command-section syntax error and the intentionally stale scaffold server after generation) and one self-corrected development failure (two removed seed paths still listed in the manifest) reduced the experience from a perfect score; no product defect or unsupported shape was found.","transcript_sha256":"70f5b46302af097c5fd01c0957e7fe50e5d0127f6437714b9467f10dff932fcb"}
