{
  "schema": "riffdb-agent-application-alpha-run/v1",
  "run_id": "alpha2-blog-rust-20260814-rerun-01",
  "bundle_hash": "a58585da8dd68b77fe70554cb16c89a4da1b1ded36da6ac8945b229d9f9058f3",
  "agent_identity": "terra-alpha2-blog-rust-20260814-rerun-01",
  "domain": "blog",
  "language": "rust",
  "independent": true,
  "fresh_context": true,
  "human_interventions": 0,
  "kernel_attempts": 0,
  "kernel_successes": 0,
  "handwritten_glue_lines": 0,
  "compiler_failures": 0,
  "runtime_failures": 0,
  "unsupported_shapes": [],
  "first_write_seconds": 145,
  "first_page_read_seconds": 145,
  "time_to_complete_seconds": 204,
  "source_access": {"riffdb_implementation": false, "ticketdesk": false},
  "boundary_passed": true,
  "golden_passed": true,
  "rating": 9.4,
  "explanation": "The public scaffold, compiler loop, generated Rust operations, exact lock, seed workflow, and generated fenced page helper supported the requested domain without kernel access or handwritten adaptation. The generated results exposed the identities required for qualified evidence. The runner performed its first page read immediately after the first write with the same returned commit fence. The rating reflects the successful end-to-end public path.",
  "transcript_sha256": "a9b45ead5616d400f3e4b34a9214d03cbff97bf3a0408bd1e41ad14728f9d0e0"
}
